{
  "$schema": "https://json-schema.org/draft/2020-12/schema",
  "$id": "https://aoa.local/aoa-memo/mechanics/retention/parts/cross-repo-and-governance-retention/schemas/cross_repo_retention_result_v1.json",
  "title": "cross_repo_retention_result_v1",
  "type": "object",
  "required": [
    "schema_version",
    "kind",
    "id",
    "status",
    "summary",
    "evidence_refs",
    "payload",
    "owner_repo"
  ],
  "properties": {
    "schema_version": {
      "type": "string",
      "const": "1.0"
    },
    "kind": {
      "type": "string",
      "const": "cross_repo_retention_result"
    },
    "id": {
      "type": "string",
      "minLength": 3
    },
    "status": {
      "type": "string",
      "enum": [
        "draft",
        "captured",
        "candidate",
        "review",
        "approved",
        "blocked",
        "rejected",
        "promoted",
        "active",
        "retired",
        "scheduled",
        "passed",
        "failed"
      ]
    },
    "summary": {
      "type": "string",
      "minLength": 1
    },
    "owner_repo": {
      "type": "string"
    },
    "evidence_refs": {
      "type": "array",
      "items": {
        "type": "string",
        "minLength": 1
      },
      "minItems": 1
    },
    "payload": {
      "type": "object",
      "required": [
        "pattern_id",
        "result",
        "cycles"
      ],
      "additionalProperties": false,
      "properties": {
        "pattern_id": {
          "type": "string"
        },
        "result": {
          "type": "string"
        },
        "cycles": {
          "type": "integer",
          "minimum": 0
        }
      }
    }
  },
  "additionalProperties": false
}
